{
  "format": "ohc.mapping",
  "specVersion": "0.1.0-draft",
  "id": "urn:ohc:mapping:ohc.grant--ode.policy--ode-0.2.0-draft.3",
  "version": "0.1.0",
  "bridgeKind": "ohc-ode",
  "from": {
    "standard": "OHC 0.1.0-draft",
    "concept": "Grant"
  },
  "to": {
    "standard": "ODE 0.2.0-draft",
    "concept": "Policy",
    "pin": {
      "tag": "v0.2.0-draft.3",
      "commit": "8300a50dd9d84d2a388fd60e3919ee59e7ad5399"
    }
  },
  "relation": "not-covered",
  "scope": "Binding statement between the two formats (OHC 0.1.0-draft and ODE release 0.2.0-draft.3); never a conversion of a person's data",
  "notIdentity": true,
  "chainable": false,
  "rowStatus": "not-permitted",
  "forbiddenUse": "A Grant is never authority to act, and a Policy is never consent. Neither is derived from the other.",
  "evidenceGrade": "F",
  "reviewedAt": "2026-10-09"
}
