{
  "format": "ohc.mapping",
  "specVersion": "0.1.0-draft",
  "id": "urn:ohc:mapping:ohc.subject--ode.party--ode-0.4.0-draft.2",
  "version": "0.1.0",
  "bridgeKind": "ohc-ode",
  "from": {
    "standard": "OHC 0.1.0-draft",
    "concept": "Subject"
  },
  "to": {
    "standard": "ODE 0.4.0-draft",
    "concept": "Party (category person)",
    "pin": {
      "tag": "v0.4.0-draft.2",
      "commit": "2de920485fb2665eaf7298ac65452a4a79412a9a"
    }
  },
  "relation": "corresponds",
  "scope": "Binding revision 0.2.0 (OHC 0.1.0-draft and ODE release 0.4.0-draft.2); a conceptual comparison, never permission to convert or disclose a person's data",
  "notIdentity": true,
  "chainable": false,
  "rowStatus": "not-identity",
  "lost": "A link between them needs an explicit mapping (the ohc.binding partyRef); it is never an identity.",
  "forbiddenUse": "Never infer access from a Party link (R-L0).",
  "evidenceGrade": "F",
  "reviewedAt": "2026-10-23"
}
