{
  "format": "ohc.mapping",
  "specVersion": "0.1.0-draft",
  "id": "urn:ohc:mapping:ohc.claim--ode.fact--ode-0.4.0-draft.2",
  "version": "0.1.0",
  "bridgeKind": "ohc-ode",
  "from": {
    "standard": "OHC 0.1.0-draft",
    "concept": "Claim"
  },
  "to": {
    "standard": "ODE 0.4.0-draft",
    "concept": "Fact",
    "pin": {
      "tag": "v0.4.0-draft.2",
      "commit": "2de920485fb2665eaf7298ac65452a4a79412a9a"
    }
  },
  "relation": "corresponds",
  "scope": "Binding revision 0.2.0 (OHC 0.1.0-draft and ODE release 0.4.0-draft.2); a conceptual comparison, never permission to convert or disclose a person's data",
  "notIdentity": true,
  "chainable": false,
  "rowStatus": "accepted-with-loss",
  "lost": "An ODE Fact requires a confidence, which a Claim may lack (a missing confidence is never 0). Origin and endorsement travel only in extensions until a Tier 1 change. Never invent confidence or copy personal values into a portable package. See ODE binding section 9.",
  "evidenceGrade": "F",
  "reviewedAt": "2026-10-23"
}
