{
  "format": "ohc.mapping",
  "specVersion": "0.1.0-draft",
  "id": "urn:ohc:mapping:ohc.interaction-preferences--ode.interaction-contract--ode-0.4.0-draft.2",
  "version": "0.1.0",
  "bridgeKind": "ohc-ode",
  "from": {
    "standard": "OHC 0.1.0-draft",
    "concept": "Claim facet preference (decision-brief, channel, timing)"
  },
  "to": {
    "standard": "ODE 0.4.0-draft",
    "concept": "InteractionContract decisionBrief / channelRef / proactivity",
    "pin": {
      "tag": "v0.4.0-draft.2",
      "commit": "2de920485fb2665eaf7298ac65452a4a79412a9a"
    }
  },
  "relation": "corresponds",
  "scope": "Binding revision 0.2.0 (OHC 0.1.0-draft and ODE release 0.4.0-draft.2); a conceptual comparison, never permission to convert or disclose a person's data",
  "notIdentity": true,
  "chainable": false,
  "rowStatus": "accepted-with-loss",
  "lost": "The reasons behind a preference stay in OHC; the contract carries the rule only. A preference never grants contact permission or data disclosure; ODE Identity, directed contact and allowedDisclosureRefs have separate bases.",
  "evidenceGrade": "F",
  "reviewedAt": "2026-10-23"
}
